root@lamp-ubuntu-s-1vcpu-1gb-tor1-01:~# tcpdump -A -i eth0
tcpdump: verbose output suppressed, use -v or -vv for full protocol decode
listening on eth0, link-type EN10MB (Ethernet), capture size 262144 bytes
19:05:56.642520 IP lamp-ubuntu-s-1vcpu-1gb-tor1-01.ssh > cpe08a7c0996b28-cm08a7c0996b26.cpe.net.cable.rogers.com.63555: Flags [P.], seq 3759310449:3759310485, ack 148097466, win 501, length 36
E..L.f@.@......Bc......C...q....P.......QcfKx#(...k.......9.. Y.0......Z..p.
19:05:56.643932 IP lamp-ubuntu-s-1vcpu-1gb-tor1-01.ssh > cpe08a7c0996b28-cm08a7c0996b26.cpe.net.cable.rogers.com.63555: Flags [P.], seq 36:144, ack 1, win 501, length 108
E....g@.@..9...Bc......C........P....9..;...%n&...}AT..w=U.$+.....^.!...`.9..
.v.HG..Qe.Y6...h....P.........!...V.`-]L..b\$!K.\.PK...[.d.!....M].;..
19:05:56.643990 IP lamp-ubuntu-s-1vcpu-1gb-tor1-01.ssh > cpe08a7c0996b28-cm08a7c0996b26.cpe.net.cable.rogers.com.63555: Flags [P.], seq 144:180, ack 1, win 501, length 36
E..L.h@.@......Bc......C........P.......-..V.v.....i.cG:a.N.kH....^.....j...
19:05:56.644044 IP lamp-ubuntu-s-1vcpu-1gb-tor1-01.ssh > cpe08a7c0996b28-cm08a7c0996b26.cpe.net.cable.rogers.com.63555: Flags [P.], seq 180:288, ack 1, win 501, length 108
E....i@.@..7...Bc......C...%....P....9...o...b.TK..u.J.;....E)M?........|.eT.{.4~BY....-6... Y.f.Dq...F"....+.*-..8uh..I.R..9.S'...L.<`...Q.g.O.....
19:05:56.644118 IP lamp-ubuntu-s-1vcpu-1gb-tor1-01.ssh > cpe08a7c0996b28-cm08a7c0996b26.cpe.net.cable.rogers.com.63555: Flags [P.], seq 288:324, ack 1, win 501, length 36
E..L.j@.@..~...Bc......C........P...........y....v......(..,..q....4.I  ...}.
19:05:56.644669 IP lamp-ubuntu-s-1vcpu-1gb-tor1-01.40979 > 67.207.67.2.domain: 33102+ [1au] PTR? 188.242.238.99.in-addr.arpa. (56)
E..T.O@.@..p...BC.C....5.@.*.N...........188.242.238.99.in-addr.arpa.......)........
19:05:56.644719 IP lamp-ubuntu-s-1vcpu-1gb-tor1-01.40843 > 67.207.67.2.domain: 14632+ [1au] PTR? 188.242.238.99.in-addr.arpa. (56)
E..T.P@.@..o...BC.C....5.@.*9(...........188.242.238.99.in-addr.arpa.......)........
19:05:56.645015 IP lamp-ubuntu-s-1vcpu-1gb-tor1-01.45558 > 67.207.67.2.domain: 51025+ [1au] PTR? 66.159.197.138.in-addr.arpa. (56)
E..T.Q@.@..n...BC.C....5.@.*.Q...........66.159.197.138.in-addr.arpa.......)........
19:05:56.645083 IP lamp-ubuntu-s-1vcpu-1gb-tor1-01.48757 > 67.207.67.2.domain: 26469+ [1au] PTR? 66.159.197.138.in-addr.arpa. (56)
E..T.R@.@..m...BC.C..u.5.@.*ge...........66.159.197.138.in-addr.arpa.......)........
19:05:56.645120 IP lamp-ubuntu-s-1vcpu-1gb-tor1-01.36597 > 67.207.67.2.domain: 29848+ [1au] PTR? 66.159.197.138.in-addr.arpa. (56)
E..T.S@.@..l...BC.C....5.@.*t............66.159.197.138.in-addr.arpa.......)........
19:05:56.645686 IP 67.207.67.2.domain > lamp-ubuntu-s-1vcpu-1gb-tor1-01.40843: 14632 1/0/1 PTR cpe08a7c0996b28-cm08a7c0996b26.cpe.net.cable.rogers.com. (125)
E.....@.?...C.C....B.5....x.9(...........188.242.238.99.in-addr.arpa................9.cpe08a7c0996b28-cm08a7c0996b26.cpe.net.cable.rogers.com...)........
19:05:56.645704 IP lamp-ubuntu-s-1vcpu-1gb-tor1-01 > 67.207.67.2: ICMP lamp-ubuntu-s-1vcpu-1gb-tor1-01 udp port 40843 unreachable, length 161
E....z..@..5...BC.C....l....E.....@.?...C.C....B.5....x.9(...........188.242.238.99.in-addr.arpa................9.cpe08a7c0996b28-cm08a7c0996b26.cpe.net.cable.rogers.com...)........
19:05:56.645715 IP 67.207.67.2.domain > lamp-ubuntu-s-1vcpu-1gb-tor1-01.40979: 33102 1/0/1 PTR cpe08a7c0996b28-cm08a7c0996b26.cpe.net.cable.rogers.com. (125)
E.....@.?...C.C....B.5..../..N...........188.242.238.99.in-addr.arpa................9.cpe08a7c0996b28-cm08a7c0996b26.cpe.net.cable.rogers.com...)........
19:05:56.645719 IP lamp-ubuntu-s-1vcpu-1gb-tor1-01 > 67.207.67.2: ICMP lamp-ubuntu-s-1vcpu-1gb-tor1-01 udp port 40979 unreachable, length 161
E....{..@..4...BC.C....l....E.....@.?...C.C....B.5..../..N...........188.242.238.99.in-addr.arpa................9.cpe08a7c0996b28-cm08a7c0996b26.cpe.net.cable.rogers.com...)........
19:05:56.645888 IP 67.207.67.2.domain > lamp-ubuntu-s-1vcpu-1gb-tor1-01.36597: 29848 NXDomain 0/1/1 (123)
E.....@.?...C.C....B.5......t............66.159.197.138.in-addr.arpa..............".7.ns1.digitalocean.com.
hostmaster..a.t...*0.....       :.......)........
19:05:56.645943 IP 67.207.67.2.domain > lamp-ubuntu-s-1vcpu-1gb-tor1-01.45558: 51025 NXDomain 0/1/1 (123)
E.....@.?...C.C....B.5....C..Q...........66.159.197.138.in-addr.arpa..............".7.ns1.digitalocean.com.
hostmaster..a.t...*0.....       :.......)........
19:05:56.645961 IP lamp-ubuntu-s-1vcpu-1gb-tor1-01.36597 > 67.207.67.2.domain: 29848+ PTR? 66.159.197.138.in-addr.arpa. (45)
E..I.T@.@..v...BC.C....5.5..t............66.159.197.138.in-addr.arpa.....
19:05:56.645971 IP 67.207.67.2.domain > lamp-ubuntu-s-1vcpu-1gb-tor1-01.48757: 26469 NXDomain 0/1/1 (123)
E.....@.?...C.C....B.5.u...Nge...........66.159.197.138.in-addr.arpa..............".7.ns1.digitalocean.com.
hostmaster..a.t...*0.....       :.......)........
19:05:56.646045 IP lamp-ubuntu-s-1vcpu-1gb-tor1-01.45558 > 67.207.67.2.domain: 51025+ PTR? 66.159.197.138.in-addr.arpa. (45)
E..I.U@.@..u...BC.C....5.5...Q...........66.159.197.138.in-addr.arpa.....
19:05:56.646081 IP lamp-ubuntu-s-1vcpu-1gb-tor1-01.48757 > 67.207.67.2.domain: 26469+ PTR? 66.159.197.138.in-addr.arpa. (45)
E..I.V@.@..t...BC.C..u.5.5..ge...........66.159.197.138.in-addr.arpa.....
19:05:56.646122 IP 67.207.67.2.domain > lamp-ubuntu-s-1vcpu-1gb-tor1-01.36597: 29848 NXDomain 0/1/0 (112)
E.....@.?...C.C....B.5...x..t............66.159.197.138.in-addr.arpa..............".7.ns1.digitalocean.com.
hostmaster..a.t...*0.....       :.....
19:05:56.646276 IP 67.207.67.2.domain > lamp-ubuntu-s-1vcpu-1gb-tor1-01.45558: 51025 NXDomain 0/1/0 (112)
E.....@.?...C.C....B.5...xl..Q...........66.159.197.138.in-addr.arpa..............".7.ns1.digitalocean.com.
hostmaster..a.t...*0.....       :.....
19:05:56.646276 IP 67.207.67.2.domain > lamp-ubuntu-s-1vcpu-1gb-tor1-01.48757: 26469 NXDomain 0/1/0 (112)
E.....@.?...C.C....B.5.u.x.gge...........66.159.197.138.in-addr.arpa..............".7.ns1.digitalocean.com.
hostmaster..a.t...*0.....       :.....
19:05:56.646611 IP lamp-ubuntu-s-1vcpu-1gb-tor1-01.ssh > cpe08a7c0996b28-cm08a7c0996b26.cpe.net.cable.rogers.com.63555: Flags [P.], seq 324:552, ack 1, win 501, length 228